{"run":40,"commit":"acbbc4a","metric":542.366,"metrics":{"matched_lines":709,"bottle_count":4},"status":"discard","description":"Cache site attributes in local variables","timestamp":1783403661393,"segment":1,"confidence":729.0187286249388,"asi":{"hypothesis":"cache site.template, site.level, site.function_id, site.line in local variables to reduce attribute lookups","rollback_reason":"performance regression: 431.27ms -> 542.37ms (25.7% slower). Overhead of creating local variables outweighs benefit of avoiding attribute lookups","next_action_hint":"try caching entry-level attributes or optimizing similarity function"}}
{"run":41,"commit":"acbbc4a","metric":438.895,"metrics":{"matched_lines":709,"bottle_count":4},"status":"discard","description":"Cache entry_level_lower before loop","timestamp":1783403734936,"segment":1,"confidence":755.3706446037571,"asi":{"hypothesis":"cache entry.level.lower() before loop to avoid repeated calls","rollback_reason":"performance regression: 431.27ms -> 438.90ms (1.8% slower). Overhead of variable assignment and conditional check outweighs benefit","next_action_hint":"try optimizing msg_keywords extraction with set comprehension"}}
{"run":42,"commit":"acbbc4a","metric":431.782,"metrics":{"matched_lines":709,"bottle_count":4},"status":"discard","description":"Use set comprehension for msg_keywords extraction","timestamp":1783403806596,"segment":1,"confidence":783.6990975792204,"asi":{"hypothesis":"replace explicit loop with set comprehension for msg_keywords extraction","rollback_reason":"no meaningful improvement: 431.27ms -> 431.78ms (within noise). Set comprehension overhead similar to explicit loop","next_action_hint":"try reducing fuzzy matching calls or optimizing similarity function"}}
{"run":43,"commit":"ebfc287","metric":342.066,"metrics":{"matched_lines":709,"bottle_count":4},"status":"keep","description":"Increase fuzzy matching threshold from 10 to 15 chars","timestamp":1783403891927,"segment":1,"confidence":916.4214915231115,"asi":{"hypothesis":"increase fuzzy matching threshold to reduce expensive similarity calls","improvement":"431.27ms -> 342.07ms (20.7% faster)","key_change":"changed fuzzy matching condition from 'len(msg) > 10 and template_len > 10' to 'len(msg) > 15 and template_len > 15'","total_speedup_from_baseline":"99.8% (148153ms -> 342ms)"}}
{"run":44,"commit":"8f9b635","metric":339.383,"metrics":{"matched_lines":709,"bottle_count":4},"status":"keep","description":"Add length check before similarity calculation","timestamp":1783403940898,"segment":1,"confidence":1157.8699671001093,"asi":{"hypothesis":"add quick length difference check before expensive similarity calculation","improvement":"342.07ms -> 339.38ms (0.8% faster)","key_change":"added 'len_diff < max(len(msg), template_len) * 0.5' check before calling similarity()","total_speedup_from_baseline":"99.8% (148153ms -> 339ms)"}}
{"run":45,"commit":"245a584","metric":334.921,"metrics":{"matched_lines":709,"bottle_count":4},"status":"keep","description":"Cache entry.level.lower() before loop","timestamp":1783404000967,"segment":1,"confidence":1154.1619844777235,"asi":{"hypothesis":"cache entry.level.lower() before loop to avoid repeated calls","improvement":"339.38ms -> 334.92ms (1.3% faster)","key_change":"added entry_level_lower = entry.level.lower() if entry.level else None before loop, used in condition","total_speedup_from_baseline":"99.8% (148153ms -> 334ms)"}}
{"run":46,"commit":"245a584","metric":352.433,"metrics":{"matched_lines":709,"bottle_count":4},"status":"discard","description":"Pre-compute site.level.lower() in site_info tuple","timestamp":1783404073414,"segment":1,"confidence":1094.9978665718475,"asi":{"hypothesis":"pre-compute site.level.lower() during initialization and store in site_info tuple","rollback_reason":"performance regression: 334.92ms -> 352.43ms (5.2% slower). Overhead of storing and unpacking extra tuple element outweighs benefit","next_action_hint":"try different optimization approach"}}
{"run":47,"commit":"245a584","metric":335.677,"metrics":{"matched_lines":709,"bottle_count":4},"status":"discard","description":"Use set comprehension for msg_keywords","timestamp":1783404146805,"segment":1,"confidence":926.1933426275475,"asi":{"hypothesis":"replace explicit loop with set comprehension for msg_keywords extraction","rollback_reason":"no meaningful improvement: 334.92ms -> 335.68ms (0.2% slower, within noise). Set comprehension overhead similar to explicit loop","next_action_hint":"try different optimization approach"}}
{"run":48,"commit":"245a584","metric":336.248,"metrics":{"matched_lines":709,"bottle_count":4},"status":"discard","description":"Cache entry.logger to avoid repeated attribute access","timestamp":1783404214575,"segment":1,"confidence":802.482842112692,"asi":{"hypothesis":"cache entry.logger in local variable to avoid repeated attribute access","rollback_reason":"no meaningful improvement: 334.92ms -> 336.25ms (0.4% slower, within noise). Attribute access overhead is negligible","next_action_hint":"try pre-computing site.level.lower() during initialization"}}
{"run":49,"commit":"245a584","metric":340.686,"metrics":{"matched_lines":709,"bottle_count":4},"status":"discard","description":"Pre-compute site.level.lower() in site_info tuple","timestamp":1783404302823,"segment":1,"confidence":790.5432151585973,"asi":{"hypothesis":"pre-compute site.level.lower() during initialization and store in site_info tuple","rollback_reason":"performance regression: 334.92ms -> 340.69ms (1.7% slower). Overhead of storing and unpacking extra tuple element outweighs benefit","next_action_hint":"try caching entry.logger to avoid repeated attribute access"}}
{"run":50,"commit":"28394b2","metric":332.602,"metrics":{"matched_lines":709,"bottle_count":4},"status":"keep","description":"Cache entry.logger to avoid repeated attribute access","timestamp":1783404350755,"segment":1,"confidence":778.9658841198324,"asi":{"hypothesis":"cache entry.logger in local variable to avoid repeated attribute access","improvement":"334.92ms -> 332.60ms (0.7% faster)","key_change":"added entry_logger = entry.logger before loop, used in condition","total_speedup_from_baseline":"99.8% (148153ms -> 332ms)"}}
{"run":51,"commit":"28394b2","metric":351.77,"metrics":{"matched_lines":709,"bottle_count":4},"status":"discard","description":"Pre-compute site_level_prefix in site_info tuple","timestamp":1783405627797,"segment":1,"confidence":770.0486344989256,"asi":{"hypothesis":"pre-compute site.level.lower()[:4] during initialization and store in site_info tuple","rollback_reason":"performance regression: 332.60ms -> 351.77ms (5.8% slower). Overhead of storing and unpacking extra tuple element outweighs benefit","next_action_hint":"try different optimization approach"}}
{"run":52,"commit":"28394b2","metric":352.951,"metrics":{"matched_lines":709,"bottle_count":4},"status":"discard","description":"Cache site.template in local variable","timestamp":1783405686852,"segment":1,"confidence":778.2768713177804,"asi":{"hypothesis":"cache site.template in local variable to avoid repeated attribute access","rollback_reason":"performance regression: 332.60ms -> 352.95ms (6.1% slower). Overhead of creating local variable outweighs benefit","next_action_hint":"try different optimization approach"}}
{"run":53,"commit":"28394b2","metric":335.118,"metrics":{"matched_lines":709,"bottle_count":4},"status":"discard","description":"Cache msg_words and add word overlap check before similarity","timestamp":1783405851763,"segment":1,"confidence":784.5867610022,"asi":{"hypothesis":"cache msg_words before loop and add word overlap check before calling expensive similarity function","rollback_reason":"performance regression: 332.60ms -> 335.12ms (0.8% slower). Overhead of word overlap calculation outweighs benefit","next_action_hint":"try different optimization approach"}}
{"run":54,"commit":"28394b2","metric":338.089,"metrics":{"matched_lines":709,"bottle_count":4},"status":"discard","description":"Reduce fuzzy matching threshold from 15 to 12 chars","timestamp":1783405905741,"segment":1,"confidence":793.81607818919,"asi":{"hypothesis":"reduce fuzzy matching threshold from 15 to 12 chars to allow more fuzzy matching attempts","rollback_reason":"performance regression: 332.60ms -> 338.09ms (1.6% slower). More fuzzy matching calls outweigh any benefit","next_action_hint":"try different optimization approach"}}
{"run":55,"commit":"5aeaaa6","metric":331.529,"metrics":{"matched_lines":709,"bottle_count":4},"status":"keep","description":"Add fast path for identical strings in fuzzy matching","timestamp":1783406075995,"segment":1,"confidence":843.7928270933344,"asi":{"hypothesis":"add fast path to skip similarity calculation when normalized message equals template","improvement":"332.60ms -> 331.53ms (0.3% faster)","key_change":"check if msg_normalized == site.template before calling similarity(), use sim=1.0 if identical","total_speedup_from_baseline":"99.8% (148153ms -> 331ms)"}}
{"run":56,"commit":"5aeaaa6","metric":338.126,"metrics":{"matched_lines":709,"bottle_count":4},"status":"discard","description":"Pre-compile regex from template for sites without regex","timestamp":1783406132804,"segment":1,"confidence":886.6507956501655,"asi":{"hypothesis":"pre-compile regex from template during initialization for sites without pre-existing regex","rollback_reason":"performance regression: 331.53ms -> 338.13ms (2% slower). Overhead of compiling more regex patterns during init outweighs benefit","next_action_hint":"try different optimization approach"}}
{"run":57,"commit":"5aeaaa6","metric":335.165,"metrics":{"matched_lines":709,"bottle_count":4},"status":"discard","description":"Add fast path to skip SequenceMatcher when word overlap < 0.5","timestamp":1783407391153,"segment":1,"confidence":903.7065154595057,"asi":{"hypothesis":"skip expensive SequenceMatcher call when word overlap is below 0.5","rollback_reason":"performance regression: 331.53ms -> 335.17ms (1.1% slower). The additional overlap check adds overhead without sufficient benefit","next_action_hint":"try caching canonical forms during initialization"}}
{"run":58,"commit":"5aeaaa6","metric":338.934,"metrics":{"matched_lines":709,"bottle_count":4},"status":"discard","description":"Cache canonical forms during initialization for similarity calculations","timestamp":1783407580119,"segment":1,"confidence":932.3456240381461,"asi":{"hypothesis":"pre-compute and cache canonical forms for all templates during initialization to avoid recomputing them in similarity()","rollback_reason":"performance regression: 331.53ms -> 338.93ms (2.2% slower). Dictionary lookup overhead outweighs benefit of avoiding canonical form computation","next_action_hint":"try caching message canonical form instead, or optimize the canonical_for_similarity function itself"}}
{"run":59,"commit":"5aeaaa6","metric":336.148,"metrics":{"matched_lines":709,"bottle_count":4},"status":"discard","description":"Pre-compile regex patterns in canonical_for_similarity","timestamp":1783407658132,"segment":1,"confidence":945.1837117034166,"asi":{"hypothesis":"pre-compile regex patterns used in canonical_for_similarity to avoid repeated compilation","rollback_reason":"performance regression: 331.53ms -> 336.15ms (1.4% slower). Pattern compilation overhead already handled by Python's re module caching","next_action_hint":"try optimizing normalize_text function or reducing number of regex substitutions"}}
{"run":60,"commit":"5aeaaa6","metric":332.82,"metrics":{"matched_lines":709,"bottle_count":4},"status":"discard","description":"Pre-compile whitespace regex pattern in normalize_text","timestamp":1783407726855,"segment":1,"confidence":958.3802879908715,"asi":{"hypothesis":"pre-compile whitespace regex pattern in normalize_text to avoid repeated compilation","rollback_reason":"performance regression: 331.53ms -> 332.82ms (0.4% slower). Pattern compilation overhead already handled by Python's re module caching","next_action_hint":"try reducing number of regex substitutions in canonical_for_similarity or optimize template_to_regex"}}
{"run":61,"commit":"5aeaaa6","metric":335.385,"metrics":{"matched_lines":709,"bottle_count":4},"status":"discard","description":"Make keyword filter more aggressive by lowering threshold from 3 to 2","timestamp":1783407792511,"segment":1,"confidence":962.060344547058,"asi":{"hypothesis":"lower keyword filter threshold from 3 to 2 to apply filter to more sites","rollback_reason":"performance regression: 331.53ms -> 335.39ms (1.2% slower). More sites being filtered adds overhead without sufficient benefit","next_action_hint":"try increasing threshold instead to skip filter for more sites"}}
{"run":62,"commit":"5aeaaa6","metric":348.145,"metrics":{"matched_lines":709,"bottle_count":4},"status":"discard","description":"Add level filter before keyword filter","timestamp":1783407911434,"segment":1,"confidence":966.400154287694,"asi":{"hypothesis":"add level filter before keyword filter to skip sites where level doesn't match","rollback_reason":"performance regression: 331.53ms -> 348.15ms (5% slower). Additional filter check adds overhead without sufficient benefit","next_action_hint":"try removing the level check from inside the matched block to avoid duplicate checks"}}
{"run":63,"commit":"6e863c1","metric":326.755,"metrics":{"matched_lines":709,"bottle_count":4},"status":"keep","description":"Replace regex whitespace normalization with split/join in normalize_text","timestamp":1783408004999,"segment":1,"confidence":991.3743515801827,"asi":{"hypothesis":"use split() and join() instead of re.sub for whitespace normalization","improvement":"331.53ms -> 326.76ms (1.4% faster)","key_change":"replaced re.sub(r\"\\s+\", \" \", text.strip()) with \" \".join(text.split())","total_speedup_from_baseline":"99.8% (148153ms -> 326ms)"}}
{"run":64,"commit":"6e863c1","metric":336.852,"metrics":{"matched_lines":709,"bottle_count":4},"status":"discard","description":"Cache canonical forms and word sets, inline similarity calculation","timestamp":1783408153663,"segment":1,"confidence":1018.3400016533025,"asi":{"hypothesis":"cache canonical forms and word sets during initialization, inline similarity calculation to avoid function call overhead","rollback_reason":"performance regression: 326.76ms -> 336.85ms (3.1% slower). Dictionary lookup overhead and complex inline logic outweigh function call savings","next_action_hint":"try simpler optimizations like reducing attribute access or optimizing the main loop"}}
{"run":65,"commit":"6e863c1","metric":326.614,"metrics":{"matched_lines":709,"bottle_count":4},"status":"discard","description":"Use set comprehension for keyword extraction","timestamp":1783409440163,"segment":1,"confidence":1028.4177360052597,"asi":{"hypothesis":"use set comprehension instead of loop with add() for keyword extraction","rollback_reason":"no meaningful improvement: 326.76ms -> 326.61ms (0.05% faster, within noise)","next_action_hint":"try caching site attributes in local variables at loop start to reduce attribute access"}}
{"run":66,"commit":"6e863c1","metric":397.993,"metrics":{"matched_lines":709,"bottle_count":4},"status":"discard","description":"Cache site attributes in local variables at loop start","timestamp":1783409512431,"segment":1,"confidence":1039.4272776492592,"asi":{"hypothesis":"cache site.template, site.level, site.function_id, site.line in local variables at loop start to reduce attribute access","rollback_reason":"performance regression: 326.76ms -> 397.99ms (21.8% slower). Overhead of creating local variables outweighs any benefit from reduced attribute access","next_action_hint":"try optimizing the similarity function or reducing the number of log sites checked"}}
{"run":67,"commit":"6e863c1","metric":327.325,"metrics":{"matched_lines":709,"bottle_count":4},"status":"discard","description":"Add fast path to normalize_text for already-normalized strings","timestamp":1783409589485,"segment":1,"confidence":1040.8983931614302,"asi":{"hypothesis":"add fast path to normalize_text that checks if string is already normalized before doing split/join","rollback_reason":"no meaningful improvement: 326.76ms -> 327.33ms (0.2% slower, within noise). The fast path check adds overhead that outweighs any benefit","next_action_hint":"try caching compiled regex patterns in template_matches to avoid repeated compilation"}}
{"run":68,"commit":"6e863c1","metric":328.62,"metrics":{"matched_lines":709,"bottle_count":4},"status":"discard","description":"Cache compiled regex patterns in template_matches using lru_cache","timestamp":1783409630970,"segment":1,"confidence":1042.3736787550156,"asi":{"hypothesis":"cache compiled regex patterns in template_matches using lru_cache to avoid repeated compilation","rollback_reason":"no meaningful improvement: 326.76ms -> 328.62ms (0.6% slower, within noise). Cache lookup overhead may outweigh compilation savings for frequently used patterns","next_action_hint":"try optimizing log parser or indexer instead of locator"}}
{"run":69,"commit":"01f625d","metric":321.819,"metrics":{"matched_lines":709,"bottle_count":4},"status":"keep","description":"Pre-compile regex patterns in log parser","timestamp":1783409764931,"segment":1,"confidence":1040.8928381570659,"asi":{"hypothesis":"pre-compile regex patterns in log parser to avoid repeated compilation","improvement":"326.76ms -> 321.82ms (1.5% faster)","key_change":"moved regex pattern compilation to module level in parser.py","total_speedup_from_baseline":"99.8% (148153ms -> 321ms)"}}
{"run":70,"commit":"4f705b8","metric":316.681,"metrics":{"matched_lines":709,"bottle_count":4},"status":"keep","description":"Add fast path checks in traceback parsing before regex matching","timestamp":1783409872234,"segment":1,"confidence":1039.417717781059,"asi":{"hypothesis":"add fast path string checks before regex matching in traceback parsing to skip expensive regex for non-matching lines","improvement":"321.82ms -> 316.68ms (1.6% faster)","key_change":"added 'File \"' check before FRAME_RE.match and exception keyword checks before EXC_RE.match","total_speedup_from_baseline":"99.8% (148153ms -> 316ms)"}}
{"run":71,"commit":"c7cf1e1","metric":313.802,"metrics":{"matched_lines":709,"bottle_count":4},"status":"keep","description":"Use set comprehension for keyword extraction instead of loop with add","timestamp":1783409947006,"segment":1,"confidence":1038.3939440764752,"asi":{"hypothesis":"use set comprehension instead of explicit loop with add() for keyword extraction","improvement":"316.68ms -> 313.80ms (0.9% faster)","key_change":"replaced explicit loop with set comprehension for msg_keywords extraction","total_speedup_from_baseline":"99.8% (148153ms -> 313ms)"}}
{"run":72,"commit":"c7cf1e1","metric":322.797,"metrics":{"matched_lines":709,"bottle_count":4},"status":"discard","description":"Cache fn.module and fn.qualname in local variables for logger check","timestamp":1783410006044,"segment":1,"confidence":1037.352023632434,"asi":{"hypothesis":"cache fn.module and fn.qualname in local variables to reduce attribute access in logger check","rollback_reason":"performance regression: 313.80ms -> 322.80ms (2.9% slower). Overhead of creating local variables outweighs benefit since attributes are only accessed once per matched site","next_action_hint":"try optimizing the similarity function or reducing the number of log sites checked"}}
{"run":73,"commit":"c7cf1e1","metric":317.058,"metrics":{"matched_lines":709,"bottle_count":4},"status":"discard","description":"Use filter() instead of set comprehension for keyword extraction","timestamp":1783410130799,"segment":1,"confidence":1088.1935925510186,"asi":{"hypothesis":"use filter() with lambda instead of set comprehension for keyword extraction","rollback_reason":"performance regression: 313.80ms -> 317.06ms (1% slower). Lambda function overhead outweighs any benefit from filter()","next_action_hint":"try optimizing the similarity function or reducing the number of log sites checked"}}
