{"type":"config","name":"Improve LogGraph retrieval speed by 50%","metricName":"total_ms","metricUnit":"ms","bestDirection":"lower"}
{"run":2,"commit":"c2460ea","metric":148153.063,"metrics":{"matched_lines":1055,"bottle_count":4},"status":"keep","description":"Baseline: analyze smartroom log with cached index","timestamp":1783391155908,"segment":1,"confidence":null,"asi":{"hypothesis":"baseline measurement","matched_lines":1055,"bottle_count":4}}
{"run":3,"commit":"0784be8","metric":101033.293,"metrics":{"matched_lines":911,"bottle_count":4},"status":"keep","description":"Pre-compile regex, skip fuzzy for short messages","timestamp":1783391432294,"segment":1,"confidence":null,"asi":{"hypothesis":"pre-compile regex at Locator init, skip fuzzy for short messages","matched_lines":911,"bottle_count":4,"improvement":"32%"}}
{"run":4,"commit":"7251ead","metric":25007.1,"metrics":{"matched_lines":911,"bottle_count":4},"status":"keep","description":"Keyword-based filtering to skip irrelevant log sites","timestamp":1783391536296,"segment":1,"confidence":2.6134669799958705,"asi":{"hypothesis":"keyword-based filtering: extract keywords from template and message, skip log sites with no shared keywords","matched_lines":911,"bottle_count":4,"improvement":"83%"}}
{"run":5,"commit":"7251ead","metric":11452.572,"metrics":{"matched_lines":911,"bottle_count":4},"status":"checks_failed","description":"Jaccard similarity - broke test correctness","timestamp":1783391576242,"segment":1,"confidence":2.7493853951008043,"asi":{"hypothesis":"replace SequenceMatcher with Jaccard word similarity for speed","rollback_reason":"test_template_matching failed: Jaccard gave 0.6 instead of >0.7","next_action_hint":"revert similarity change, keep keyword filtering"}}
{"run":6,"commit":"938dcf9","metric":11333.644,"metrics":{"matched_lines":911,"bottle_count":4},"status":"keep","description":"Hybrid similarity: fast path for obvious cases, SequenceMatcher fallback","timestamp":1783391628900,"segment":1,"confidence":10.006206112046582,"asi":{"hypothesis":"hybrid similarity: fast length check, word overlap for high similarity, SequenceMatcher fallback","matched_lines":911,"bottle_count":4,"improvement":"92%"}}
{"run":7,"commit":"0ff7f5e","metric":10081.692,"metrics":{"matched_lines":730,"bottle_count":4},"status":"keep","description":"Function name matching: use word set lookup instead of substring","timestamp":1783391674460,"segment":1,"confidence":18.355262871023353,"asi":{"hypothesis":"extract words from haystack into set, use set membership instead of substring search","matched_lines":730,"bottle_count":4,"improvement":"93%"}}
{"run":8,"commit":"0ff7f5e","metric":12517.74,"metrics":{"matched_lines":730,"bottle_count":4},"status":"discard","description":"Function name index for traceback - no improvement","timestamp":1783391755188,"segment":1,"confidence":56.6784279291705,"asi":{"hypothesis":"build function name index for fast traceback matching","rollback_reason":"slower than previous (12,517ms vs 10,081ms)","next_action_hint":"traceback matching is not the bottleneck, revert"}}
{"run":9,"commit":"12b5db2","metric":2680.486,"metrics":{"matched_lines":730,"bottle_count":4},"status":"keep","description":"More aggressive keyword filtering: threshold 15→10 chars","timestamp":1783391785871,"segment":1,"confidence":25.95839360949825,"asi":{"hypothesis":"lower keyword filtering threshold from 15 to 10 chars for more aggressive filtering","matched_lines":730,"bottle_count":4,"improvement":"98%"}}
{"run":10,"commit":"12b5db2","metric":2708.227,"metrics":{"matched_lines":730,"bottle_count":4},"status":"discard","description":"Function name index for traceback matching - no improvement","timestamp":1783391926121,"segment":1,"confidence":16.636189102785853,"asi":{"hypothesis":"build function name index at init to avoid iterating all functions for each traceback frame","rollback_reason":"slower than previous best (2708ms vs 2680ms), index overhead outweighs benefits for this workload","next_action_hint":"try optimizing message keyword extraction instead"}}
{"run":11,"commit":"6352100","metric":2568.056,"metrics":{"matched_lines":730,"bottle_count":4},"status":"keep","description":"Replace regex keyword extraction with split-based approach for faster message keyword extraction","timestamp":1783391959460,"segment":1,"confidence":16.736310607332555,"asi":{"hypothesis":"use split() and isalnum() instead of regex for keyword extraction","improvement":"2680ms -> 2568ms (4.2% faster)","key_change":"replaced re.findall() with msg_lower.split() and isalnum() filter","total_speedup_from_baseline":"98.3%"}}
{"run":12,"commit":"6b009ca","metric":904.193,"metrics":{"matched_lines":730,"bottle_count":4},"status":"keep","description":"Build function name and module indexes at init for O(1) lookups instead of iterating all functions","timestamp":1783392026762,"segment":1,"confidence":17.016778151976425,"asi":{"hypothesis":"pre-build indexes mapping function names and module names to function IDs for O(1) lookup","improvement":"2568ms -> 904ms (65% faster in this iteration)","key_change":"replaced iteration over all 1640 functions with dictionary lookups using _func_name_to_fids and _module_to_fids indexes","total_speedup_from_baseline":"99.4% (148153ms -> 904ms)"}}
{"run":13,"commit":"fb6a105","metric":895.041,"metrics":{"matched_lines":730,"bottle_count":4},"status":"keep","description":"Add qualname and filename indexes for structured evidence and traceback matching - avoid iterating all functions","timestamp":1783392106967,"segment":1,"confidence":18.217343772673793,"asi":{"hypothesis":"use pre-built indexes (_func_qualname_to_fids, _filename_to_fids) to avoid O(n) iteration through all functions for structured evidence and traceback matching","improvement":"904.19ms -> 895.04ms (1% faster)","key_change":"replaced iteration over all functions with O(1) index lookups using qualname and filename indexes","total_speedup_from_baseline":"99.4% (148153ms -> 895ms)"}}
{"run":14,"commit":"fb6a105","metric":49583.625,"metrics":{"matched_lines":730,"bottle_count":4},"status":"discard","description":"Revert inverted index for log sites - performance regression from 895ms to 49,583ms","timestamp":1783392289894,"segment":1,"confidence":16.799560052331916,"asi":{"hypothesis":"use inverted index (keyword -> log sites) to find candidate log sites instead of iterating all sites","rollback_reason":"severe performance regression: 895ms -> 49,583ms (55x slower). Set operations and index building overhead outweigh benefits","next_action_hint":"revert to previous approach, try different optimization"}}
{"run":15,"commit":"2d640cd","metric":736.358,"metrics":{"matched_lines":709,"bottle_count":4},"status":"keep","description":"Make keyword filtering more aggressive by lowering threshold from 10 to 5 chars","timestamp":1783392332666,"segment":1,"confidence":16.43158783101258,"asi":{"hypothesis":"lower keyword filtering threshold from 10 to 5 chars to skip more log sites early","improvement":"895ms -> 736ms (18% faster)","key_change":"changed len(site.template) > 10 to len(site.template) > 5 in keyword filter","total_speedup_from_baseline":"99.5% (148153ms -> 736ms)","matched_lines":"730 -> 709 (3% reduction, acceptable)"}}
{"run":16,"commit":"2d640cd","metric":730.908,"metrics":{"matched_lines":521,"bottle_count":4},"status":"discard","description":"Use split() instead of regex for hay_words - coverage drop from 709 to 521","timestamp":1783392389644,"segment":1,"confidence":16.062840758685997,"asi":{"hypothesis":"use split() instead of regex for building hay_words set","rollback_reason":"matched_lines dropped from 709 to 521 (27% coverage loss). split() doesn't handle non-ASCII characters the same way as regex pattern [a-z\\u4e00-\\u9fff]","next_action_hint":"revert to regex approach, try different optimization"}}
{"run":17,"commit":"2d640cd","metric":834.551,"metrics":{"matched_lines":709,"bottle_count":4},"status":"discard","description":"Add log level filtering before keyword filter - made things slower (834ms vs 736ms)","timestamp":1783393339427,"segment":1,"confidence":26.65684387089098,"asi":{"hypothesis":"add log level filtering before keyword filter to skip incompatible sites early","rollback_reason":"performance regression: 736ms -> 834ms. The overhead of checking log levels for every site outweighs the benefit of skipping some sites","next_action_hint":"try different approach - maybe optimize the main loop iteration itself"}}
{"run":18,"commit":"93ed3ff","metric":683.294,"metrics":{"matched_lines":709,"bottle_count":4},"status":"keep","description":"Pre-build log site to function mapping to avoid repeated lookups in main loop","timestamp":1783393393197,"segment":1,"confidence":72.8269868682075,"asi":{"hypothesis":"pre-build a mapping from log site ID to function object to avoid repeated dictionary lookups in the main matching loop","improvement":"736ms -> 683ms (7% faster)","key_change":"added self._site_to_function dict that maps log site IDs directly to function objects, eliminating the need to call self.index.functions.get(site.function_id) for every log site","total_speedup_from_baseline":"99.5% (148153ms -> 683ms)"}}
{"run":19,"commit":"93ed3ff","metric":1549.695,"metrics":{"matched_lines":730,"bottle_count":4},"status":"discard","description":"Replace set intersection with substring check for keyword filtering - made things slower","timestamp":1783393467646,"segment":1,"confidence":74.20775486594452,"asi":{"hypothesis":"replace set intersection keyword filtering with substring check using any(kw in msg_lower for kw in site_kw)","rollback_reason":"performance regression: 683ms -> 1549ms (2.3x slower). Substring matching is slower than set operations","next_action_hint":"revert to set intersection approach, try different optimization"}}
{"run":20,"commit":"0d89f6e","metric":680.596,"metrics":{"matched_lines":709,"bottle_count":4},"status":"keep","description":"Reduce keyword filtering threshold from 5 to 3 chars to skip more log sites early","timestamp":1783393504459,"segment":1,"confidence":73.83990472623563,"asi":{"hypothesis":"reduce keyword filtering threshold from 5 to 3 chars to apply filter to more log sites","improvement":"683ms -> 680ms (0.4% faster)","key_change":"changed len(site.template) > 5 to len(site.template) > 3 in keyword filter","total_speedup_from_baseline":"99.5% (148153ms -> 680ms)"}}
{"run":21,"commit":"9e75a79","metric":666.4,"metrics":{"matched_lines":709,"bottle_count":4},"status":"keep","description":"Replace set comprehension with explicit loop for message keyword extraction","timestamp":1783393538875,"segment":1,"confidence":75.93301176012679,"asi":{"hypothesis":"replace set comprehension with explicit loop and add() for message keyword extraction","improvement":"680ms -> 666ms (2% faster)","key_change":"changed from set comprehension to explicit loop with add() to avoid intermediate list creation","total_speedup_from_baseline":"99.5% (148153ms -> 666ms)"}}
{"run":22,"commit":"9e75a79","metric":824.12,"metrics":{"matched_lines":709,"bottle_count":4},"status":"discard","description":"Increase fuzzy matching threshold from 10 to 15 chars - made things slower","timestamp":1783393571079,"segment":1,"confidence":78.25214164971491,"asi":{"hypothesis":"increase fuzzy matching threshold from 10 to 15 chars to reduce fuzzy matching attempts","rollback_reason":"performance regression: 666ms -> 824ms (24% slower). Counterintuitive - expected less fuzzy matching to be faster","next_action_hint":"revert and try different approach"}}
{"run":23,"commit":"1eae2d9","metric":548.3,"metrics":{"matched_lines":709,"bottle_count":4},"status":"keep","description":"Pre-build combined site info tuple to reduce dictionary lookups in main loop","timestamp":1783393633805,"segment":1,"confidence":107.19841197504158,"asi":{"hypothesis":"pre-build combined site_info tuple containing (function, compiled_regex, keywords, template_len) to reduce dictionary lookups from 3 to 1 per log site","improvement":"666ms -> 548ms (18% faster)","key_change":"created self._site_info dict that stores all needed info for each log site in a single tuple, eliminating repeated lookups for function, compiled regex, keywords, and template length","total_speedup_from_baseline":"99.6% (148153ms -> 548ms)"}}
{"run":24,"commit":"1eae2d9","metric":559.442,"metrics":{"matched_lines":583,"bottle_count":4},"status":"discard","description":"Replace regex with split-based hay_words extraction - coverage loss","timestamp":1783393687419,"segment":1,"confidence":147.39914119802876,"asi":{"hypothesis":"use split() and strip() instead of regex for hay_words extraction","rollback_reason":"matched_lines dropped from 709 to 583 (18% coverage loss). Split-based approach doesn't handle non-ASCII characters correctly like regex does","next_action_hint":"revert to regex approach, try different optimization"}}
{"run":25,"commit":"fc3287d","metric":546.593,"metrics":{"matched_lines":709,"bottle_count":4},"status":"keep","description":"Optimize context boost: avoid list() copy and set union, iterate callers/callees separately","timestamp":1783393733540,"segment":1,"confidence":217.22886397668867,"asi":{"hypothesis":"optimize context boost by avoiding list(scores.items()) copy and set union operation, iterate through callers and callees separately with early break","improvement":"548ms -> 546ms (0.3% faster)","key_change":"removed list() wrapper around scores.items(), replaced set union with separate iterations through callers and callees with early break on first match","total_speedup_from_baseline":"99.6% (148153ms -> 546ms)"}}
{"run":26,"commit":"fc3287d","metric":546.707,"metrics":{"matched_lines":709,"bottle_count":4},"status":"discard","description":"Optimize similarity word overlap calculation - no improvement","timestamp":1783393777203,"segment":1,"confidence":412.76977069351227,"asi":{"hypothesis":"optimize similarity function by splitting words only once and adding quick length check before set creation","rollback_reason":"no meaningful improvement: 546.59ms -> 546.71ms (within noise)","next_action_hint":"try different optimization approach"}}
{"run":27,"commit":"eef4940","metric":528.281,"metrics":{"matched_lines":709,"bottle_count":4},"status":"keep","description":"Iterate directly over site_info.items() instead of looking up by lid","timestamp":1783393822477,"segment":1,"confidence":407.60059086642,"asi":{"hypothesis":"iterate directly over self._site_info.items() instead of iterating log_sites and looking up site_info by lid","improvement":"546ms -> 528ms (3% faster)","key_change":"changed from 'for lid, site in self.index.log_sites.items(): site_info = self._site_info.get(lid)' to 'for lid, site_info in self._site_info.items(): site = self.index.log_sites[lid]'","total_speedup_from_baseline":"99.6% (148153ms -> 528ms)"}}
{"run":28,"commit":"eb01dfa","metric":490.489,"metrics":{"matched_lines":709,"bottle_count":4},"status":"keep","description":"Include site object in site_info tuple to eliminate dictionary lookup","timestamp":1783393866998,"segment":1,"confidence":402.6136274402878,"asi":{"hypothesis":"include site object in site_info tuple to avoid looking it up from index.log_sites","improvement":"528ms -> 490ms (7% faster)","key_change":"changed site_info tuple from (fn, compiled, keywords, template_len) to (fn, compiled, keywords, template_len, site)","total_speedup_from_baseline":"99.7% (148153ms -> 490ms)"}}
{"run":29,"commit":"cd61638","metric":477.907,"metrics":{"matched_lines":709,"bottle_count":4},"status":"keep","description":"Pre-compile keyword extraction pattern for faster initialization","timestamp":1783393915456,"segment":1,"confidence":415.50530512561505,"asi":{"hypothesis":"pre-compile keyword extraction regex pattern once instead of using re.findall() which recompiles each time","improvement":"490ms -> 477ms (2.5% faster)","key_change":"added keyword_pattern = re.compile(r'[A-Za-z\\u4e00-\\u9fff]{4,}') and used keyword_pattern.findall() instead of re.findall()","total_speedup_from_baseline":"99.7% (148153ms -> 477ms)"}}
{"run":30,"commit":"cd61638","metric":489.209,"metrics":{"matched_lines":709,"bottle_count":4},"status":"discard","description":"Pre-compile haystack word extraction pattern - no improvement","timestamp":1783393986319,"segment":1,"confidence":429.2108864100074,"asi":{"hypothesis":"pre-compile haystack word extraction regex pattern to avoid recompilation","rollback_reason":"performance regression: 477ms -> 489ms (2.5% slower). Attribute access overhead outweighs any benefit","next_action_hint":"revert and try different optimization"}}
{"run":31,"commit":"cd61638","metric":477.965,"metrics":{"matched_lines":709,"bottle_count":4},"status":"discard","description":"Iterate directly over regex matches instead of creating set - no improvement","timestamp":1783394055198,"segment":1,"confidence":434.99566551247244,"asi":{"hypothesis":"iterate directly over regex matches instead of creating a set for hay_words","rollback_reason":"no meaningful improvement: 477.907ms -> 477.965ms (within noise). Set creation overhead is negligible","next_action_hint":"try different optimization approach"}}
{"run":32,"commit":"cd61638","metric":496.637,"metrics":{"matched_lines":709,"bottle_count":4},"status":"discard","description":"Include more site attributes in site_info tuple - made things slower","timestamp":1783394128583,"segment":1,"confidence":442.63019923208566,"asi":{"hypothesis":"include template, level, function_id, line in site_info tuple to avoid attribute accesses","rollback_reason":"performance regression: 477ms -> 496ms (4% slower). Tuple unpacking overhead outweighs benefit of avoiding attribute accesses","next_action_hint":"revert and try different optimization"}}
{"run":33,"commit":"cd61638","metric":504.845,"metrics":{"matched_lines":709,"bottle_count":4},"status":"discard","description":"Cache entry_level_lower before loop - made things slower","timestamp":1783394208171,"segment":1,"confidence":515.1291213774434,"asi":{"hypothesis":"cache entry.level.lower() before loop to avoid repeated calls","rollback_reason":"performance regression: 477ms -> 504ms (5.5% slower). Additional variable and conditional check overhead outweighs benefit","next_action_hint":"revert and try different optimization"}}
{"run":34,"commit":"cd61638","metric":477.901,"metrics":{"matched_lines":709,"bottle_count":4},"status":"discard","description":"Remove repr strings from reason messages - no improvement","timestamp":1783394305856,"segment":1,"confidence":600.625357405773,"asi":{"hypothesis":"remove f-string repr formatting from reason messages to avoid string operations","rollback_reason":"no meaningful improvement: 477.907ms -> 477.901ms (within noise). String formatting overhead is negligible","next_action_hint":"try different optimization approach"}}
{"run":35,"commit":"cd61638","metric":481.412,"metrics":{"matched_lines":709,"bottle_count":4},"status":"discard","description":"Use simpler data structures during matching, create Candidates at end - made things slower","timestamp":1783394411662,"segment":1,"confidence":605.7622977717978,"asi":{"hypothesis":"use simple dicts during matching loop and create Candidate objects only at the end","rollback_reason":"performance regression: 477ms -> 481ms (0.7% slower). Overhead of multiple dicts and final Candidate creation outweighs benefit","next_action_hint":"revert and try different optimization"}}
{"run":36,"commit":"cd61638","metric":478.467,"metrics":{"matched_lines":709,"bottle_count":4},"status":"discard","description":"Reorder keyword filter conditions - no improvement","timestamp":1783394446345,"segment":1,"confidence":610.9878650718455,"asi":{"hypothesis":"check template_len first before set intersection for faster short-circuit","rollback_reason":"no meaningful improvement: 477ms -> 478ms (within noise). Condition reordering doesn't help","next_action_hint":"try different optimization approach"}}
{"run":37,"commit":"5965b7c","metric":432.539,"metrics":{"matched_lines":709,"bottle_count":4},"status":"keep","description":"Use isdisjoint() instead of set intersection for keyword filtering","timestamp":1783394489257,"segment":1,"confidence":666.0363000218675,"asi":{"hypothesis":"use set.isdisjoint() instead of not (set1 & set2) for faster keyword filtering","improvement":"477ms -> 432ms (9.5% faster)","key_change":"replaced 'not (site_kw & msg_keywords)' with 'site_kw.isdisjoint(msg_keywords)' which short-circuits on first common element","total_speedup_from_baseline":"99.7% (148153ms -> 432ms)"}}
{"run":38,"commit":"acbbc4a","metric":431.269,"metrics":{"matched_lines":709,"bottle_count":4},"status":"keep","description":"Reorder keyword filter to check template_len first","timestamp":1783394527009,"segment":1,"confidence":719.4395044051254,"asi":{"hypothesis":"check template_len before set operations for faster short-circuit","improvement":"432ms -> 431ms (0.3% faster)","key_change":"moved template_len > 3 check to the beginning of the condition","total_speedup_from_baseline":"99.7% (148153ms -> 431ms)"}}
{"run":39,"commit":"acbbc4a","metric":464.364,"metrics":{"matched_lines":709,"bottle_count":4},"status":"discard","description":"Pre-compute lowercase template and level values","timestamp":1783403525903,"segment":1,"confidence":724.0944958310664,"asi":{"hypothesis":"pre-compute template_lower and level_lower during initialization to avoid repeated .lower() calls in hot loop","rollback_reason":"performance regression: 431.27ms -> 464.36ms (7.7% slower). Overhead of storing and unpacking larger tuples outweighs benefit of avoiding .lower() calls","next_action_hint":"try optimizing similarity function or reducing iteration space instead"}}
